{
  "patternId": "test-only-forbid-declarative",
  "appliesTo": ["next"],
  "rule": {
    "title": "Forbid `.only` in test calls (declarative — S2-A pilot)",
    "stack": ["react-next"],
    "check": {
      "type": "declarative",
      "engine": "eslint-restricted",
      "selector": "CallExpression[callee.object.name=/^(describe|it|test)$/][callee.property.name='only']",
      "message": "remove .only — it silently disables sibling tests",
      "presence": "forbid"
    },
    "examples": {
      "bad": "it.only('should work', () => { expect(1).toBe(1); });",
      "good": "it('should work', () => { expect(1).toBe(1); });"
    },
    "negative-test": {
      "input": [
        "it.only('should work', () => { expect(1).toBe(1); });",
        "describe.only('suite', () => { it('test', () => {}); });"
      ],
      "expect-violation": "no-restricted-syntax"
    }
  },
  "rulesMdTemplate": "## {{id}} — Forbid `.only` in test calls\n\n**Stack:** react-next  \n**Check:** declarative `no-restricted-syntax` (eslint-restricted engine)  \n**Why:** `.only` silently disables all other tests in the file/suite. A CI run with `.only` committed will pass while skipping the vast majority of tests — a systematic false-positive gate. Remove `.only` or use `--testNamePattern` for focused local runs.\n",
  "eslintRuleConfig": {}
}
